{"schemaVersion":"work-contract@1","target":{"repositoryId":"independent-activation-target","baseCommit":"dc089f496313c97e5072b95ef2df9167749d8141","candidate":{"kind":"COMMIT","id":"7a4756d9112dddf2836ea01f9f9b8c14b7d200bb"}},"objectiveId":"valid-value-with-no-marker","acceptanceCriterionIds":["value-one","no-gate-marker"],"scope":{"allowed":["src/"],"readonly":[],"forbidden":["policy/"]},"validationCommands":[{"commandId":"independent-value","phase":"CANDIDATE_VALIDATION","argv":["node","--input-type=module","-e","import assert from \"node:assert/strict\"; import {value} from \"./src/value.mjs\"; assert.equal(value,1);"]}],"policyProfile":{"profileId":"independent-profile","path":"policy/profile.json","digest":"sha256:3059ae3ad2c5a894bc3d451e8a97ca7d50a7242f4088f2338d9c4b5977c39229"},"capabilityIndex":null,"priorArtQuery":null,"mechanismRegistry":null,"artifactRoot":"artifacts/","maxRuntimeSeconds":60,"resourceCeilings":{"maxOutputBytes":65536,"maxArtifactBytes":2097152,"maxProcesses":1},"authorization":{"identity":"independent-experimenter","issuedAt":"2026-09-08T21:25:00Z","signature":null}}
